name;price;description;img_link
Маргарита;799;Традиционный рецепт пиццы с Моцареллой, сочными томатами, фирменным томатным соусом и орегано;https://img.freepik.com/free-photo/pizza-with-cheese-tomato-isolated-white-background-pizza-margarita-top-view-photo-menu_639032-289.jpg?t=st=1713300620~exp=1713304220~hmac=16be06a61b38932fbeed8cabb84cc11b13b9733c8de34f5e5109600ccb2f030a&w=740
Четыре сыра;1079;Традиционное сочетание сыров: Моцарелла, мягкий молодой сыр, сыр с голубой плесенью, Чеддер;https://img.freepik.com/premium-photo/overhead-view-isolated-on-white-of-a-whole-freshly-baked-delicious-four-cheeses-italian-pizza-on-white-background-still-life-copy-space_639032-288.jpg?w=740
Пепперони;889;Американская классика с пикантной пепперони, Моцареллой и фирменным томатным соусом;https://img.freepik.com/free-photo/thinly-sliced-pepperoni-is-a-popular-pizza-topping-in-american-style-pizzerias-isolated-on-white-background-still-life_639032-229.jpg?w=740&t=st=1713298993~exp=1713299593~hmac=1ba2d660d62261280971062abcd13c8d739ed97dfa1e4750c58f453ed2847294
Ветчина и грибы;799;Ветчина, шампиньоны, увеличенная порция моцареллы, фирменный томатный соус;https://img.freepik.com/premium-photo/fresh-pizza-with-mushrooms-ham-cheese-on-white-background-copy-space-homemade-with-love-fast-delivery-recipe-and-menu-top-view_639032-290.jpg?w=740
Мясное Барбекю;1099;Супермясная пицца с пикантной пепперони, ветчиной, беконом, говядиной, Моцареллой и фирменным томатным соусом;https://img.freepik.com/premium-photo/ham-and-sausage-pizza-on-white-background-copy-space-homemade-with-love-fast-delivery-recipe-and-menu-top-view_639032-294.jpg?w=740
Гавайский Цыплёнок;999;Сыр моцарелла, нежная куриная грудка, ароматная ветчина, сочные ананасы, лук с соусом "Барбекю";https://img.freepik.com/premium-photo/delicious-italian-pizza-with-pineapples-and-chicken-fillet-isolated-on-white-background-still-life-copy-space-top-view-flat-lay_639032-296.jpg?w=740
Маленькая Италия;899;Сыр моцарелла, пикантная пепперони, ароматная свинина, орегано, шампиньоны, черные оливки с фирменным томатным соусом;https://img.freepik.com/free-photo/delicious-italian-pizza-with-tomato-olives-pepperoni-and-mushrooms-top-view-isolated-on-white-background-still-life-copy-space_639032-291.jpg?w=740&t=st=1713297835~exp=1713298435~hmac=0f7d0c5f446ec40cc5006ead2f48aad47eabd143f2e909d2e2b1731d56335187
Курица и Грибы;599;Пикантная пицца с сочным куриным филе, ароматным беконом, соусом "Чесночный Рэнч", Моцареллой, чесноком и томатами;https://img.freepik.com/free-photo/meat-chicken-mushrooms-pizza-isolated-white-background-top-view-photo-menu_639032-293.jpg?t=st=1713297707~exp=1713301307~hmac=2e3c34a3ee6033d105d9c8f22b3419071fe091afcf628fe3ab43c8275005d2d6&w=740