name;price;description;img_link
Маргарита;799;Традиционный рецепт пиццы с Моцареллой, сочными томатами, фирменным томатным соусом и орегано;https://img.freepik.com/free-photo/pizza-with-cheese-and-tomato-isolated-on-white-background-pizza-margarita-top-view-photo-for-the-menu_639032-301.jpg?w=740&t=st=1713296139~exp=1713296739~hmac=65a66d7d617eb37d827938e99e4f17c0ca7d7390655ff997787842d0a92a3eb0
Четыре сыра;1079;Традиционное сочетание сыров: Моцарелла, мягкий молодой сыр, сыр с голубой плесенью, Чеддер, фирменный томатный соус и орегано;https://img.freepik.com/premium-photo/overhead-view-isolated-on-white-of-a-whole-freshly-baked-delicious-four-cheeses-italian-pizza-on-white-background-still-life-copy-space_639032-288.jpg?w=740
Пепперони;889;Американская классика с пикантной пепперони, Моцареллой и фирменным томатным соусом;https://img.freepik.com/free-photo/thinly-sliced-pepperoni-is-a-popular-pizza-topping-in-american-style-pizzerias-isolated-on-white-background-still-life_639032-229.jpg?w=740&t=st=1713298993~exp=1713299593~hmac=1ba2d660d62261280971062abcd13c8d739ed97dfa1e4750c58f453ed2847294
Ветчина и грибы;799;Ветчина, моцарелла, фирменный соус альфредо;https://img.freepik.com/free-photo/fresh-pizza-with-mushrooms-ham-cheese-white-background-copy-space-homemade-with-love-fast-delivery-recipe-menu-top-view_639032-297.jpg?t=st=1713297575~exp=1713301175~hmac=2b150cdafb536bcad4379231611ad39a0784393bf7612eb1a1e859b7d741bad8&w=740
Мясное Барбекю;1099;Супермясная пицца с пикантной пепперони, ветчиной, беконом, ароматной свининой, говядиной, Моцареллой и фирменным томатным соусом;https://img.freepik.com/premium-photo/ham-and-sausage-pizza-on-white-background-copy-space-homemade-with-love-fast-delivery-recipe-and-menu-top-view_639032-294.jpg?w=740
Гавайский Цыплёнок Барбекю;999;Сыр моцарелла, нежная куриная грудка, ароматная ветчина, сочные ананасы, лук с соусом "Барбекю";https://img.freepik.com/premium-photo/delicious-italian-pizza-with-pineapples-and-chicken-fillet-isolated-on-white-background-still-life-copy-space-top-view-flat-lay_639032-296.jpg?w=740
Маленькая Италия;899;Сыр моцарелла, пикантная пепперони, ароматная свинина, орегано, шампиньоны, черные оливки с фирменным томатным соусом;https://img.freepik.com/free-photo/delicious-italian-pizza-with-tomato-olives-pepperoni-and-mushrooms-top-view-isolated-on-white-background-still-life-copy-space_639032-291.jpg?w=740&t=st=1713297835~exp=1713298435~hmac=0f7d0c5f446ec40cc5006ead2f48aad47eabd143f2e909d2e2b1731d56335187